document_id,question,answer,difficulty
/indian_states/Punjab.txt,Did Indian independence movement create a division between the rich and the middle and lower classes?,Yes,H
/indian_states/Punjab.txt,What is the second most common religion in Indian Punjab?,Hinduism,H
/indian_states/Punjab.txt,Did Mughul rule come after the Gupta Empire in the timeline of Punjab?,Yes,H
/indian_states/Punjab.txt,Is Sufism well-established in Punjab?,Yes,M
/indian_states/Punjab.txt,What kind of language do Punjabi people speak?,Indo-Aryan Punjabi language,M
/indian_states/Punjab.txt,Which city became a center of the Ismaili sect of Islam after the Umayyad caliphate conquered the region in 711 AD?,the city of Multan,M
/indian_states/Punjab.txt,Which province was a new provinced established in 1901?,the Norht-West Frontier Province ,H
/indian_states/Punjab.txt,Do children work in Punjab?,yes,M
/indian_states/Punjab.txt,Are all modern Punjabis Sunni Muslim?,no,M
/indian_states/Punjab.txt,The rivers referenced in the meaning of Punjab are tributaries of which river?,The Indus River,H
/indian_states/Punjab.txt,What is the meaning of the first word part of the Persian original word of Punjab?,five,M
/indian_states/Punjab.txt,Which language did Punjabi people speak?,Indo-Aryan Punjabi language,M
/indian_states/Punjab.txt,Did the Indus Valley Civilization flourish from 9000 B.C?,No,M
/indian_states/Punjab.txt,What ethnolinguistic group is the majority in Pakistan?,Punjabi Muslims,H
/indian_states/Punjab.txt,What is the meaning of the second word part of the Persian original word of Punjab?,water,M
/indian_states/Punjab.txt,How does Punjab contribute to India and Pakistan's economy?,agriculture,M
/indian_states/Punjab.txt,Is Punjabi still used today?,Yes,M
/indian_states/Punjab.txt,Whose kingdom spanned between rivers Hydaspes and Acesines?,King Porus,M
/indian_states/Punjab.txt,Which cities in Punjab have a city-proper population of over a million?,"Faisalabad, Rawalpindi, Gujranwala, Multan, Ludhiana, Amritsar, Jalandhar, Chandigarh, and Lahore",H
/indian_states/Punjab.txt,How long did the Turkic Ghaznavids in the tenth century ruled after overthrew the Hindu Shahis?,157 years,M
/indian_states/Punjab.txt,What empire existed in the Punjab between 1799 and 1849?,the Sikh empire,H
/indian_states/Punjab.txt,What half of the Punjab province became part of India at the time of partition in 1947? ,East Punjab,H
/indian_states/Punjab.txt,In which months does Punjab get the most rainfall?,July to September,M
/indian_states/Punjab.txt,Are fruits grown in the Punjabi region?,Yes,M
/indian_states/Punjab.txt,Was Punjab divided into two parts in 1940?,No,M
/indian_states/Punjab.txt,Does the Punjab region of India and Pakistan have a historical and cultural link to Americans?,No,M
/indian_states/Punjab.txt,"According to Richard M. Eaton, who is the father of Khizr Khan?",Punjabi chieftain,M
/indian_states/Punjab.txt,Did the Mughals take control of the Punjab region from the Mughals?,No,M
/indian_states/Punjab.txt,Is there a hot season and monsoon season in the Punjab region?,Yes,H
/indian_states/Punjab.txt,Which massacre in Punjab bolstered the Indian independence movement?,Jallinanwala,M
/indian_states/Punjab.txt,Between what years was the punjab insurgency?,1973-1995,M
/indian_states/Punjab.txt,Which war ended the Sikh empire established by Maharaja Ranjit Singh?,Second Anglo-Sikh War,H
/indian_states/Punjab.txt,Who is the Mughal empire in the period 1645-1656 during the Mughal era?,Saadullah Khan,M
/indian_states/Punjab.txt,Does over a quarter of people in the Punjab region of Pakistan work in agriculture?,Yes,H
/indian_states/Punjab.txt,When did Sikh Empire stopped ruling the Punjab?,1849,M
/indian_states/Punjab.txt,What was Punjab's capital when Saadullah Khan was Grand vizierv of the Mughal empire?,Lahore,H
/indian_states/Punjab.txt,Which mountain ranges are to the north of Punjab?,Himalayan ranges,M
/indian_states/Punjab.txt,How many years did Turkic Ghaznavids ruled Hindu Shahis?,157,M
/indian_states/Punjab.txt,Did the Mughals once control the Punjab?,Yes,M
/indian_states/Punjab.txt,Is Punjab the richest large state in India?,No,M
/indian_states/Punjab.txt,Did east Punjab become part of India in 1947?,Yes,M
/indian_states/Punjab.txt,"According to Strabo, how many cities did King Porus's territory contain? ",300,H
/indian_states/Punjab.txt,"Are wheat, rice, and cotton crops grown in the Punjabi region?",Yes,M
/indian_states/Punjab.txt,Who did the Punjabi region ally with and provide resources to during World War I?,the British,H
/indian_states/Punjab.txt,Are vegetables grown in the Punjabi region?,Yes,M
/indian_states/Punjab.txt,Did Sikhism convert significant Muslims and Hindus in the Punjab region? ,Yes,H
/indian_states/Punjab.txt,Does Panjab produce significant amounts of food?,Yes,M
/indian_states/Punjab.txt,Punjab's foodgrain production has given the state what nickname?,The Bread Basket of India,M
/indian_states/Punjab.txt,Did the Mughals control the Punjab region after the Sikh Empire?,No,H
/indian_states/Punjab.txt,"When was Indian Punjab divided into Punjab, Haryana, and Himachal Pradesh?",1966,M
/indian_states/Punjab.txt,Did Christiannity largely replace Buddism in Punjab?,No,H
/indian_states/Punjab.txt,Why did Afghan take over?,The Mughal power weakened,M
/indian_states/Punjab.txt,Which Indian state has five rivers based on its name?,Punjab,M
/indian_states/Punjab.txt,What is the major religious group in Pakistan,Punjabi Muslims,H
/indian_states/Punjab.txt,Is a lot of the religious diversity within Punjabis a recent change?,no,M
/indian_states/Punjab.txt,What is the historical and current capital of Punjab?,Lahore,M
/indian_states/Punjab.txt,What was last major region of India to be annexed by Britain?,Punjab,M
/indian_states/Punjab.txt,Why was Punjab important to Britain?,rich farmlands,M
/indian_states/Punjab.txt,Was the Reign of Ashoka before the Rise of the Sakas?,Yes,M
/indian_states/Punjab.txt,What is Hinduism largely shaped by?,The Vedic religion,H
/indian_states/Punjab.txt,Is Jhelum the largest tributary of the Indus?,No,H
/indian_states/Punjab.txt,Is Punjab in the southern part of India?,No,M
/indian_states/Punjab.txt,Which five rivers are there in Punjab?,"Jhelum, Chenab, Ravi, Sutlej, and Beas",H
/indian_states/Punjab.txt,Is it true that most of Indian Punjabis are Shia Muslims?,No,H
/indian_states/Punjab.txt,Who got control of the Punjab region after the Sikh Empire?,the British,M
/indian_states/Punjab.txt,In which year did the Jallianwala massacre take place?,1919,H
/indian_states/Punjab.txt,Have the boundaries of the Punjab region changed many times throughout history?,Yes,M
/indian_states/Punjab.txt,Is it true that a majority of Indian Punjabis are Sikh?,Yes,H
/indian_states/Punjab.txt,Was the Islam Shah Suri after Mughal rule?,Yes,M
/indian_states/Punjab.txt,Why are there so many ethnic groups that make up the Punjab?,Because of several invasions,M
/indian_states/Punjab.txt,What are some of the religious traditions of Punjabi Muslims and Hindus?,"Hindu festivals, New year's day of Hindus,Baisakhi, and Tazias",H
/indian_states/Punjab.txt,Did the Vedic religion influence Hinduism?,Yes,M
/indian_states/Punjab.txt,Is Christianity present in Pakistani Punjab?,Yes,M
/indian_states/Punjab.txt,Was the Punjab region one of the earliest areas to be become urbanized?,Yes,M
/indian_states/Punjab.txt,Is the Punjabi language used in education and administration in Pakistani Punjab?,No,M
/indian_states/Punjab.txt,Was Muslim the first religion practiced by Punjabis?,no,M
/indian_states/Punjab.txt,Is there more than one religion present in the Punjabi region?,Yes,H
/indian_states/Punjab.txt,Which dynasty emerged in the Punjab in ninth century?,the Hindu Shahi dynasty ,M
/indian_states/Punjab.txt,Is Punjab in the southern part of India?,No,M
/indian_states/Punjab.txt,Is true that Islam is the second most common religion in Indian Punjab?,No,H
/indian_states/Punjab.txt,The predominant ethnolinguistic group of the Punjab region is the Punjabi people who speak English,No,M
/indian_states/Punjab.txt,When was India partitioned?,1947,M
/indian_states/Punjab.txt,Do more people in modern day Pakistan practice Sunni Muslim religion than Shia Muslim?,Yes,M
/indian_states/Punjab.txt,When did the British annex Punjab?,1849,M
/indian_states/Punjab.txt,What ancient Hindu epic chronicles the history of dynasties in the Punjab?,the Mahabharata,M
/indian_states/Punjab.txt,Did the Mongols invade the Punjab region?,Yes,M
/indian_states/Punjab.txt,Do the religious majorities of Panjab vary by region?,Yes,H
/indian_states/Punjab.txt,What countries make up the Punjab region?,Pakistan and India,M
/indian_states/Punjab.txt,Did the Punjab region continuously flourish?,no,M
/indian_states/Punjab.txt,Which group of people emerged as the major power in southern Punjab after the Umayyad caliphate conquered the region?,Islam,M
/indian_states/Punjab.txt,In what way is Punjabi the major language?,It has official status and is used in education and administration,H
/languages/Arabic_language.txt,Is Classical Arabic considered Standard Arabic?,Yes,M
/languages/Arabic_language.txt,Why has the influence of Arabic has been most important in Islamic countries?,"it is the language of the Islamic sacred book, the Quran",M
/languages/Arabic_language.txt,What caused Egypt to push for an Egyptianization of the Arabic language?,Colonialism,H
/languages/Arabic_language.txt,What is the Arabic term for the process of giving a new shade of meaning to an old classical word?,Tawleed,M
/languages/Arabic_language.txt,Was the Arabic Academies first established in Damascus?,Yes,M
/languages/Arabic_language.txt,What do the dialects of Arabic have in common with the Romance languages?,How they differ between each other,H
/languages/Arabic_language.txt,Did Arabic emerge after the 4th century CE?,No,M
/languages/Arabic_language.txt,How many people outside of Egypt speak the dialect of Egyptian Arabic?,2 million,H
/languages/Arabic_language.txt,How many people speak Levantine Arabic?,21 million people,M
/languages/Arabic_language.txt,Which languages are the official language of more states than Arabic?,English and French,H
/languages/Arabic_language.txt,What is the Islamic sacred book called?,The Quran,M
/languages/Arabic_language.txt,Is the energetic mood used in Classical Arabic?,Yes.,H
/languages/Arabic_language.txt,Where is the lowest-value position placed on Arabic numerals?,The right,H
/languages/Arabic_language.txt,Can the Romance languages be linguistically considered separate languages?,Yes.,H
/languages/Arabic_language.txt,Does Modern Standard Arabic have five pure vowels?,No,M
/languages/Arabic_language.txt,Arabic is an important language to what religion?,Islam,H
/languages/Arabic_language.txt,Where is the newspaper La Syrie headquartered?,Beirut,M
/languages/Arabic_language.txt,What religion is Arabic commonly associated with?,Islam,H
/languages/Arabic_language.txt,Is Arabic related to languages in the subgroups of the Semitic language group?,Yes.,M
/languages/Arabic_language.txt,What important figurative device was introduced to poetry by the Quran?,Repetition,H
/languages/Arabic_language.txt,Which language is derived from Arabic but uses Latin letters?,Maltese,M
/languages/Arabic_language.txt,What year was the Amiri Press first established?,1819,M
/languages/Arabic_language.txt,How long did the Romance languages take to diverge?,2000 years,M
/languages/Arabic_language.txt,Is Ancient North Arabian a dialect of Arabic?,No,H
/languages/Arabic_language.txt,What official languages are used in more states then Arabic?,English and French.,M
/languages/Arabic_language.txt,Is Al-Khalil ibn Ahmad al-Farahidithe first Arabic Dictionry Compiler?,Yes,M
/languages/Arabic_language.txt,Who was the chairman of the Writing and Grammar Committee for the Arabic Language Academy of Cairo in 1944?,Abd Al-Aziz Fahmi,M
/languages/Arabic_language.txt,How was the Quran written?,In a simple and understandable format,M
/languages/Arabic_language.txt,When was Abu al-Aswad al-Du'ali born?,603,M
/languages/Arabic_language.txt,Does Classical Arabic largely share much of the same grammatical standars as Modern Standard Arabic?,Yes.,M
/languages/Arabic_language.txt,How many variants of Arabic arised in the Hejaz during late pre-Islamic times,two,H
/languages/Arabic_language.txt,When was Lisān al-ʿArab written?,1290,M
/languages/Arabic_language.txt,How many morae are needed for a syllable type to be a heavy syllable?,Two,M
/languages/Arabic_language.txt,Has anyone ever standardized Arabic grammar?,Yes.,M
/languages/Arabic_language.txt,What book served as inspiration to Islamic poets?,The Quran,M
/languages/Arabic_language.txt,What is the language root of Arabic?,Semitic language ,M
/languages/Arabic_language.txt,Does Arabic have an alphabet?,Yes,M
/languages/Arabic_language.txt,Does Modern Standard Arabic have more pure vowels than most modern dialects?,no,M
/languages/Arabic_language.txt,Do more states have Arabic or English as an official language?,English,M
/languages/Arabic_language.txt,What are Romance languages often compared to?,Arabic,M
/languages/Arabic_language.txt,What are the three most useful language for business?,"English, Standard Mandarin Chinese, and French",M
/languages/Arabic_language.txt,What are the two kinds of syllables?,open and closed,M
/languages/Arabic_language.txt,May a final short vowel be stressed?,No,M
/languages/Arabic_language.txt,What type of passive was formed by the addition of endings to the mood forms?,Internal,M
/languages/Arabic_language.txt,What do the terms Safaitic and Hismaic mean?,Old Arabic,M
/languages/Arabic_language.txt,What language is the Quran written in?,Arabic,M
/languages/Arabic_language.txt,How many official languages does the United Nations recognize?,Six,M
/languages/Arabic_language.txt,How many people speak Levantine Arabic?,About 21 million,M
/languages/Arabic_language.txt,The suras are placed in what order?,The longest are placed first and shorter ones follow,H
/languages/Arabic_language.txt,What is Sibawayhi's book based on?,A corpus of poetic texts,M
/languages/Arabic_language.txt,Is Arabic one of the six offical languages of United Nation?,Yes,M
/languages/Arabic_language.txt,Did Ibn Manzur first created Lisan al-Arab?,Yes,M
/languages/Arabic_language.txt,How many official languages does the UN have?,Six,H
/languages/Arabic_language.txt,Does 26 states use Arabic as an official language?,Yes,M
/languages/Arabic_language.txt,What is the abbreviation for Modern Standard Arabic?,MSA,M
/languages/Arabic_language.txt,Where was the earliest attestation of Old Arabic thought to be?,Qaryat Al-Faw,M
/languages/Arabic_language.txt,is Sībawayhi's al-Kitāb the name of the first comprehensive description of the Arabic language?,Yes,M
/languages/Arabic_language.txt,Who spoke Arabic in the 1st century BC?,Nobody,H
/languages/Arabic_language.txt,What is the new vocabulary from the spoken varieties used to denote?,Concepts that have arisen in the industrial and post-industrial era,M
/languages/Arabic_language.txt,When was the Arabization Bureau added to the ECSO?,1997,M
/languages/Arabic_language.txt,Did Massignon's attempt at Romanization succeed?,No,M
/languages/Arabic_language.txt,Can two of the last three syllables be stressed?,No,H
/languages/Arabic_language.txt,When is the first possible syllabus always stressed?,When no syllable is heavy or super heavy,H
/languages/Arabic_language.txt,Is the liturgical language of the religion of Islam a Semitic language?,Yes,H
/languages/Arabic_language.txt,What is Arabic named after?,The Arabs,M
/languages/Arabic_language.txt,What religion helped Arabic to spread?,Islam,H
/languages/Arabic_language.txt,Who led the campaign for a lexical injection in Arabic?,Rifa'a al-Tahtawi,M
/languages/Arabic_language.txt,"Based on what feature, most arguments for a single ANA language were based on?",The shape of the definite article,M
/languages/Arabic_language.txt,What century was the overhaul of Grammar realized by Ibn Mada’ of Cordoba first proposed?,The 10th century.,M
/languages/Arabic_language.txt,Do a majority of Muslims speak Classical Arabic?,No,H
/languages/Arabic_language.txt,"What does ""Old Arabic"" constitute?",The precursor of Arabic,M
/constellations/virgo_constellation.txt,Can Virgo be seen at the equator?,Yes.,M
/constellations/virgo_constellation.txt,Does M84 have most likely have a black hole orbiting the core?,Yes.,H
/constellations/virgo_constellation.txt,What is the the largest zodiac constellation?,Virgo,M
/constellations/virgo_constellation.txt,Does the black hole at the center of the M87 galaxy have a mass 7.2 billion times that of the Sun?,Yes.,H
/constellations/virgo_constellation.txt,When did the constellation Virgo became associated with fertility?,c. 10th century BC,H
/constellations/virgo_constellation.txt,The Sun takes the longest to pass through which Zodiac constellation?,Virgo,H
/constellations/virgo_constellation.txt,Is virgo the home to the optically brightest quasar in the sky?,Yes,H
/constellations/virgo_constellation.txt,Where in Virgo does the celestial equator cross the ecliptic?,The First Point of Libra,H
/constellations/virgo_constellation.txt,What constellation is to the west of Virgo?,Leo,M
/constellations/virgo_constellation.txt,Is Virgo the largest constellation in the zodiac?,Yes,M
/constellations/virgo_constellation.txt,What relation do Boötes and Virgo have in mythology?,Father and daughter,M
/constellations/virgo_constellation.txt,Are all galaxies in the Virgo constellation present in the Virgo cluster?,No,H
/constellations/virgo_constellation.txt,Is Virgo the largest constellation in the sky?,No,M
/constellations/virgo_constellation.txt,What is the name of the optically brightest quasar in the sky?,Virgo,M
/constellations/virgo_constellation.txt,Does the name of the constellation with the brightest star named Spica mean maiden in Latin?,Yes,H
/constellations/virgo_constellation.txt,Where civilization does the star Spica's name come from?,Babylon,H
/constellations/virgo_constellation.txt,Does the star Chi Virginis have a planet?,Yes.,M
/constellations/virgo_constellation.txt,When will the Sun stop being in Virgo during the autumn equinox?,The year 2440,H
/constellations/virgo_constellation.txt,What season is the Virgo constellation most prominent?,Spring.,M
/constellations/virgo_constellation.txt,What Mesopotamian god has influenced the name of Spica?,Shala.,H
/constellations/virgo_constellation.txt,Which star's system contains a planet 7.5 times that of Jupiter?,70 Virginis,M
/constellations/virgo_constellation.txt,Who is the daughter of Icarius of Athens?,Erigone.,M
/constellations/virgo_constellation.txt,What Mesopotamian god associated Virgo with fertility?,Shala.,H
/constellations/virgo_constellation.txt,Is the Sombrero Galaxy part of the Virgo cluster?,No,H
/constellations/virgo_constellation.txt,Does the star 70 Virionis have a planet?,Yes.,M
/constellations/virgo_constellation.txt,Is Virgo most prominent in the autumn sky?,No.,M
/constellations/virgo_constellation.txt,Is the Sombrero galaxy part of the Virgo cluster?,No,M
/constellations/virgo_constellation.txt,What is the largest zodiac constellation?,Virgo.,M
/constellations/virgo_constellation.txt,Who god did the Romans associate with Virgo?,Ceres.,H
/constellations/virgo_constellation.txt,Is Virgo the largest constellation in the sky?,No,M
/constellations/virgo_constellation.txt,Is Virgo the smallest zodiac constellation?,No,M
/constellations/virgo_constellation.txt,Is the constellation with the brightest star named Spica the largest constellation in the zodiac?,Yes,H
/constellations/virgo_constellation.txt,Is NGC 4438 a small planet?,No.,M
/constellations/virgo_constellation.txt,Is the planet Jupiter larger than all planets that orbit stars in the Virgo constellation?,No,H
/constellations/virgo_constellation.txt,The Furrow was part of which constellation?,Virgo,H
/constellations/virgo_constellation.txt,What is the Virgo prominent season?,Spring,M
/constellations/virgo_constellation.txt,Where is Virgo located relative to the other constellations in the sky?,Between Leo and Libra.,H
/constellations/virgo_constellation.txt,What is the largest constellation in the sky?,Hydra,M
/constellations/virgo_constellation.txt,Who is the daughter of Icarius of Athens?,Erigone,H
/constellations/virgo_constellation.txt,What is the brightest star in Virgo?,Spica,M
/constellations/virgo_constellation.txt,Is Virgo located in the second quadrant of the southern hemisphere?,No,M
/constellations/virgo_constellation.txt,Is Spica a star in Virgo?,Yes,M
/constellations/virgo_constellation.txt,For how many months is Virgo visible all night?,2 months,M
/constellations/virgo_constellation.txt,Why is Virgo constellation associated with fertility?,"Because Spica is Latin for ear of grain, one of the major products of the Mesopotamian furrow.",H
/constellations/virgo_constellation.txt,Is Erigone the daughter of Zeus?,No,M
/constellations/virgo_constellation.txt,How long does the Sun take to pass through the constellation Virgo?,44 days,M
/constellations/virgo_constellation.txt,Is Virgo the largest constellation in the zodiac?,Yes,M
/constellations/virgo_constellation.txt,How many exoplanents orbit the stars in Virgo?,35,M
/constellations/virgo_constellation.txt,How far away from Earth is the Sombrero Galaxy?,28 million light-years.,M
/constellations/virgo_constellation.txt,Does the name of the largest constellation in the zodiac mean maiden in Latin?,Yes,H
/constellations/virgo_constellation.txt,Is Virgo included in Christian mythology?,Yes,M
/constellations/virgo_constellation.txt,What is the brightest star in Virgo?,Spica,M
/constellations/virgo_constellation.txt,What is the brightest star in Virgo?,Spica,M
/constellations/virgo_constellation.txt,Is Virgo the largest constellation in the sky?,No.,M
/constellations/virgo_constellation.txt,What does Virgo mean in Latin?,Maiden,M
/constellations/virgo_constellation.txt,Is the largest zodiac constellation prominent in the spring sky in the northern hemisphere?,Yes,H
/constellations/virgo_constellation.txt,Is Virgo the largest constellation in the sky?,No,M
/constellations/virgo_constellation.txt,Is Spica a bright star?,Yes,M
/constellations/virgo_constellation.txt,What caused M87 to be a major radio source?,Black hole,H
/constellations/virgo_constellation.txt,Why is Virgo easy to locate?,The bright start Spica,M
/constellations/virgo_constellation.txt,Is the black hole in M87 heavier than the Sun?,Yes,M
/constellations/virgo_constellation.txt,Is the first quasar ever to be identified also the optically brightest quasar in the sky?,Yes,H
/constellations/virgo_constellation.txt,Is Icarius killed by Dionysus,No,H
/constellations/virgo_constellation.txt,Is the first identified quasar in Virgo?,Yes,M
/constellations/virgo_constellation.txt,What constellation does the star Spica belong to?,Virgo.,M
/constellations/virgo_constellation.txt,How did Icarius of Athens die?,Killed by his shepards while they were intoxicated.,H
/constellations/virgo_constellation.txt,Which galaxy has the most massive black hole within the immediate vicinity of the Milky Way?,M87,H
/constellations/virgo_constellation.txt,Why does the sun take longer to pass through Virgo than any other zodiac?,Because Virgo is largest zodiac constellation,H
/constellations/virgo_constellation.txt,Is the constellation with the brightest star named Spica the largest constellation in the sky?,No,H
/constellations/virgo_constellation.txt,Is Hydra the largest constellation in the sky?,Yes,M
/constellations/virgo_constellation.txt,Is there a black hole ejecting jets of matter 20 ly from the center of NGC 4261?,Yes.,H
/constellations/virgo_constellation.txt,Is Virgo the largest constellation in the sky?,No,M
/constellations/virgo_constellation.txt,Which part made Virgo become associated with fertility in the Babylonian MUL.APIN?,The Furrow,H
/constellations/virgo_constellation.txt,Which galaxy in the Virgo cluster is spiral?,"Messier 58, Messier 90",M
/constellations/virgo_constellation.txt,Is Virgo the largest constealltion in the sky?,No.,M
/constellations/virgo_constellation.txt,Is the Sombrero Galaxy a planet?,No.,M
/constellations/virgo_constellation.txt,Does NY Virginis belong to the verified exoplanets orbiting the stars in Virgo?,Yes,M
/constellations/virgo_constellation.txt,Which season is Virgo constellation visible in the sky?,Spring,M
/constellations/virgo_constellation.txt,When did the Sun shift from Libra on the autumnal equinox to Virgo?,4th century BC,M
/constellations/virgo_constellation.txt,Does Leo neighbor Virgo?,Yes,M
/constellations/virgo_constellation.txt,What makes up the bulge at the center of the Sombrero Galaxy?,Older stars that are larger than normal.,H
/constellations/virgo_constellation.txt,Is Porrima a star in the Leo constellation?,No.,H
/constellations/virgo_constellation.txt,How many days it takse for Sun to pass through the Virgo?,44,M
/constellations/virgo_constellation.txt,What is Latin for maiden?,Virgo,M
/constellations/virgo_constellation.txt,What does Virgo mean in latin?,Maiden.,M
/constellations/virgo_constellation.txt,"Where is the ""furrow"" in Virgo?",The eastern sector.,M
/constellations/virgo_constellation.txt,Does the Sombrero Galaxy have a bulge at its center?,Yes.,H
/indian_states/Karnataka.txt,How many information technology (IT) firms were operating in Karnataka in 2008?,2000,H
/indian_states/Karnataka.txt,What does the ziladar do?,Governs each district (zila),M
/indian_states/Karnataka.txt,Is tourism a dead industry in Karnataka?,No.,M
/indian_states/Karnataka.txt,Is Mysore the capital of Karnataka?,No,M
/indian_states/Karnataka.txt,Is Kannada the only language spoken in  Karnataka?,No,M
