document_id,question,answer,difficulty
/languages/German_language.txt,During which period were the Old High German dialects separated from Old Saxon? ,Migration Period,M
/languages/German_language.txt,Where is German the third most taught foreign language?,continental Europe,M
/languages/German_language.txt,Was Cameroon a colony of the German Empire in 1885?,Yes,M
/languages/German_language.txt,Is German the most widely spoken west germanic language?,No,M
/languages/German_language.txt,How many people speak German as a second language?,10-25 Million,M
/languages/German_language.txt,What is the Sachsenspiegel?,The first book of laws written in Middle Low German,M
/languages/German_language.txt,What is the most spoken language in the European Union?,German,H
/languages/German_language.txt,"How many countries are a part of the ""German Sprachraum""? ",7,H
/languages/German_language.txt,"What inflected, pluricentric language is the second most commonly used scientific language?",German,H
/languages/German_language.txt,Was German the language of commerce in the Habsburg Empire prior to the mid-nineteenth century?,Yes,H
/languages/German_language.txt,Does Afrikaans belong to the same language branch as Gothic?,No,H
/languages/German_language.txt,When was the end of the Old High German period?,1050,H
/languages/German_language.txt,When would one use a compund consisting of six words in German?,humorous contexts,H
/languages/German_language.txt,Were the Merseburg Charms originally written using a printing press?,No,H
/languages/German_language.txt,The Nibelungenlied is an important work from which period/epoch? ,Middle Ages,H
/languages/German_language.txt,What are German speakers called? ,Germanophones,M
/languages/German_language.txt,What language is the most widely spoken language in the European continent? ,Russian ,H
/languages/German_language.txt,What is German word order?,SOV,M
/languages/German_language.txt,Is German an official language in Luxembourg?,Yes,M
/languages/German_language.txt,Is Germany the most widely spoken language in Europe?,No,M
/languages/German_language.txt,Where did South African Nataler Duetsch speakers come from?,Wartburg,H
/languages/German_language.txt,Is the difference between Old High German and Old Saxon their respective vowel pronounciations?,No ,H
/languages/German_language.txt,Are there states in America where German is the most commonly spoken language at home after English?,Yes,M
/languages/German_language.txt,What event marks the beginning of the history of the German language?,the High German consonant shift,M
/languages/German_language.txt,What linguistic region was awarded the most Nobel Prizes in literature?,English ,H
/languages/German_language.txt,The basis of Standard High German developed with which book?,the Luther Bible,M
/languages/German_language.txt,Did English capitalize all nouns into the 1700s? ,Yes ,M
/languages/German_language.txt,Are Alemannic dialects spoken in Stuttgart?,Yes,H
/languages/German_language.txt,Is German the most scientifically used language? ,No,M
/languages/German_language.txt,"In Namibia, about how many people still speak German today?","30,000",M
/languages/German_language.txt,How many official languages at the federal level does Switzerland have? ,4,H
/languages/German_language.txt,What event marks the end of the Early New High German period?,the end of the Thirty Years' War,M
/languages/German_language.txt,What type of German words are perceived as more scholarly? ,loanwords from Latin and Latinized Greek ,M
/languages/German_language.txt,Where was Unserdeutch spoken?,German New Guinea,M
/languages/German_language.txt,"The Nibelungenlied, whose author remains unknown, can be traced back to which epoch?",the Middle Ages,H
/languages/German_language.txt,In which Central/Eastern European empire was German the language of commerce and government?,Habsburg,M
/languages/German_language.txt,Is German mainly spoken in West Europe?,No,M
/languages/German_language.txt,Does German rank first as a foreign language in the EU in terms of student numbers across all levels of education?  ,No,M
/languages/German_language.txt,What total proportion of books are published in German?,One tenth,M
/languages/German_language.txt,The Nibelungenlied was originally written in what German variation?,Middle High German,H
/languages/German_language.txt,"Is it true that Danish, Norwegian, and Swedish contain few similarities with German?",No,H
/languages/German_language.txt,How many Germanic languages are more widely spoken than German?,one,M
/languages/German_language.txt,Is German a national language in an African country?,Yes,M
/languages/German_language.txt,What is the most spoken language on the Europe continent?,Russian,H
/languages/German_language.txt,What poem contains a mixed use of Old Saxon and Old High German dialects?,the Hildebrandslied,M
/languages/German_language.txt,Does German use a significant amount of loanwords from Greek?,Yes,M
/languages/German_language.txt,What is the most spoken language in the European Union? ,German,H
/languages/German_language.txt,In what Italianian province is German the official language?,South Tyrol,M
/languages/German_language.txt,Does German have the highest number of consonants in comparsion with other languages?,No,M
/languages/German_language.txt,What can be an example of using German in official proceedings and literature?,The mittelhochdeutsche Dichtersprache.,H
/languages/German_language.txt,How many German speakers are there in Namibia?,"30,000",M
/languages/German_language.txt,What standard German-based pidgin language	 that is nearly extinct today	 evolved in Namibia? ,Namibian Black German,H
/languages/German_language.txt,For how many years was Namibia a colony of the German empire? ,35 years,M
/languages/German_language.txt,What US states is German most commonly spoken at home?,North and South Dakota,M
/languages/German_language.txt,Is German the most widely spoken Germanic Language?,No,M
/languages/German_language.txt,Which conference ended with a complete standardization of the Standard High German language in its written form?,the Second Orthographic Conference,M
/languages/German_language.txt,What was declared standard definition of German in 1901?,the Duden Handbook,M
/languages/German_language.txt,Is High German historically distinguished as Istvaeonic? ,No,H
/languages/German_language.txt,Is German the most spoken Germanic language?,No,M
/languages/German_language.txt,Where is Barossa German spoken?,"Adelaide, Australia",M
/languages/German_language.txt,What the High German varieties spoken by the Ashkenazi Jews?,Yiddish,M
/languages/German_language.txt,Is German the most widely spoken Germanic language?,No.,M
/languages/German_language.txt,In what year was the Duden Handbook declared as the standard definition of High German?,1901,M
/languages/German_language.txt,What tribes lived in the Ostsiedlung during the Old High German period?,Slavic,H
/languages/German_language.txt,Was was proposed to be called the High German?,Irminonic,M
/languages/German_language.txt,Which of the works written in Old High German in the ninth century is focused on by scholars?,The Hildebrandslied,H
/languages/German_language.txt,In what year was the Deutsche Bühnensprache established?,1898,H
/languages/German_language.txt,Does the German consonant system has much more number of consonants in comparison with other languages?,No,M
/languages/German_language.txt,"What prefix is contained in the German verb ""mitgehen""?",kommen,H
/languages/German_language.txt,Modern Danish is in what branch of Germanic languages?,North Germanic,H
/languages/German_language.txt,"What empire were Banat, Bukovina, and Transylvania provinces of? ",the Habsburg Empire,H
/languages/German_language.txt,Is German the most spoken language in terms of native and second language in the United States?,No,M
/languages/German_language.txt,Luther's translation of the Bible into High German took place during what period?,Early New High German,M
/languages/German_language.txt,Was Muspili written in Old Low German?,No,M
/languages/German_language.txt,Is it usual that many German dialects are considered to be separate languages?,No,H
/languages/German_language.txt,What are the cases for German adjectives?,"nominative,accusative,genitive,dative",H
/languages/German_language.txt,How many grammatical genders does German have?,three,M
/languages/German_language.txt,"What gender, other than male and female, does German use grammatically?",Neuter,M
/languages/German_language.txt,Where are Bavarian dialects of German most spoken?,"Austria, Bavaria",H
/languages/German_language.txt,Is -en a inflectional ending in German?,Yes,M
/languages/German_language.txt,Is the majority of German vocabulary derived from Latin and Greek?,No,M
/languages/German_language.txt,"Is it true that Prague (German: Prag) and Budapest (Buda, German: Ofen) were Germanized because of their incorporation into the Habsburg domain?",Yes,H
/languages/German_language.txt,"Are German, Austrian, and Russian the three standardized variants of German? ",No,M
/chinese_dynasties/Han_dynasty.txt,Did Medical physicians have high status in the Han dynasty?,Yes,H
/chinese_dynasties/Han_dynasty.txt,Did slaves belong to one of twenty ranks?,No,M
/chinese_dynasties/Han_dynasty.txt,Was the landowner’s land tax paid in coin cash ,No,M
/chinese_dynasties/Han_dynasty.txt,Did the Xiongnu border the southern edge of Han territory?,No,M
/chinese_dynasties/Han_dynasty.txt,Who helped to begin the Silk Road trade network?,The diplomat Zhang Qian.,H
/chinese_dynasties/Han_dynasty.txt,Who was succeeded by the Han dynasty?,The Three Kingdoms,H
/chinese_dynasties/Han_dynasty.txt,Who presided over the Han government?,The emperor,H
/chinese_dynasties/Han_dynasty.txt,What did Southern and Northern Xiongnu disagree about?,Allyship with Han,M
/chinese_dynasties/Han_dynasty.txt,Which direction is Luoyang to Chang’an? ,East,H
/chinese_dynasties/Han_dynasty.txt,Was the emperor the highest priest in the land during the Han dynasty?,Yes,M
/chinese_dynasties/Han_dynasty.txt,Which parts of The Han empire had to pay their labor tax?,"North, South, and west",H
/chinese_dynasties/Han_dynasty.txt,"In the hierarchical social order, is the emperor at the apex of Han society and government?",Yes,M
/chinese_dynasties/Han_dynasty.txt,Who created central government monopolies administered by former merchants?,Emperor Wu,H
/chinese_dynasties/Han_dynasty.txt,Which character did modern China use to refer to people and language?,Han,M
/chinese_dynasties/Han_dynasty.txt,Did the first imperial dynasty unite the Chinese Warring States by conquest?,Yes.,H
/chinese_dynasties/Han_dynasty.txt,How long did the Eastern Han dynasty last?,205 years,M
/chinese_dynasties/Han_dynasty.txt,Are commanderies smaller than provinces in the Han empire?,Yes,M
/chinese_dynasties/Han_dynasty.txt,Which dynasty first established the money economy?,the Zhou dynasty,M
/chinese_dynasties/Han_dynasty.txt,What was reintroduced in 186 BC by Grand Empress Dowager Lü Zhi? ,government mint,H
/chinese_dynasties/Han_dynasty.txt,"What is the Chinese translation of the title ""emperor""?",Huangdi,M
/chinese_dynasties/Han_dynasty.txt,Who appointed the victor of the Chu-Han Contention?,Xiang Yu,M
/chinese_dynasties/Han_dynasty.txt,How much heavier is wuzhu compared to the coins that Emperor Wen allowed private minters to manufacture in 175 BC?,0.6g,H
/chinese_dynasties/Han_dynasty.txt,Are commanderies  larger than counties in the Han empire?,Yes,M
/chinese_dynasties/Han_dynasty.txt,Was the northern Korean Peninsula once part of the Han dynasty?,Yes,M
/chinese_dynasties/Han_dynasty.txt,Was Han dynasty before the Three Kingdoms period?,Yes.,M
/chinese_dynasties/Han_dynasty.txt,How long did Zhang Qian’s travels take? ,14 years,M
/chinese_dynasties/Han_dynasty.txt,Was outlawing slavery an unsuccessful reform in Xin dynasty?,Yes.,H
/chinese_dynasties/Han_dynasty.txt,"Was Wang Mang the  first empress, then empress dowager, and finally grand empress dowager during the reigns of the Emperors Yuan?",No,H
/chinese_dynasties/Han_dynasty.txt,When did the Han court establish four new frontier commanderies to consolidate their control of the northwestern territory?,111 BC,H
/chinese_dynasties/Han_dynasty.txt,Who is Cao Pi?,king of Wei,M
/chinese_dynasties/Han_dynasty.txt,Which king did the Han court not replace by 196 BC?,Changsha,H
/chinese_dynasties/Han_dynasty.txt,Did the Reformists in the Han dynasty promote an aggressive foreign policy?,No,H
/chinese_dynasties/Han_dynasty.txt,Was Dong Zhongshu a Confucianism scholar?,Yes.,M
/chinese_dynasties/Han_dynasty.txt,What territories did Modu Chanyu control by the end of his reign?,"Manchuria, Mongola and the Tarim Basin.",H
/chinese_dynasties/Han_dynasty.txt,Why did China's first imperial dynasty collapse?,Rebellion,H
/chinese_dynasties/Han_dynasty.txt,Did Emperor Wu influence the conflicts between the Han dynasty and Xiongnu?,Yes,M
/chinese_dynasties/Han_dynasty.txt,Were marriages highly ritualized amongst the wealthy in the Han era?,Yes,H
/chinese_dynasties/Han_dynasty.txt,Did the types of clothing worn and the materials used during the Han period vary much?,Yes,M
/chinese_dynasties/Han_dynasty.txt,Why did families throughout Han China made ritual sacrifices of animals and food to deities?,They believed that these items could be utilized by those in the spiritual realm.,H
/chinese_dynasties/Han_dynasty.txt,How did Han scholars such as Jia Yi potray the previous dynasty?,As a brutal regime,M
/chinese_dynasties/Han_dynasty.txt,Where was Huhanye Chanyu's rival claimant to the throne killed?,"In modern Taraz, Kazakhstan.",H
/chinese_dynasties/Han_dynasty.txt,Was Han China’s first imperial dynasty?,No,M
/chinese_dynasties/Han_dynasty.txt,Were the Han dynasty and the Xiongnu friendly?,No,M
/chinese_dynasties/Han_dynasty.txt,Is Qin Shi Huang  the second emperor of the Qin dynasty?,No,H
/chinese_dynasties/Han_dynasty.txt,Which emperor defeated the Xiongnu?,Emperor Wu.,M
/chinese_dynasties/Han_dynasty.txt,Is it thought that Shennong Ben Cao Jing medical text was compiled by two people’s collaboration?,Yes,M
/chinese_dynasties/Han_dynasty.txt,In which Chinese Dynasty the three-legged iron seed drill was invented in?,The Han dynasty,H
/chinese_dynasties/Han_dynasty.txt,Is the White Horse temple China's first known buddhist temple?,Yes,M
/chinese_dynasties/Han_dynasty.txt,Did the Spring and Autumn period span 241 years? ,Yes,M
/chinese_dynasties/Han_dynasty.txt,"According to Confucian family norms, were family members treated equally?",No,M
/chinese_dynasties/Han_dynasty.txt,Who killed Huhanye's rival claimant to the throne?,Han forces,M
/chinese_dynasties/Han_dynasty.txt,When did Qing Dynasty fall?,1912 AD,M
/chinese_dynasties/Han_dynasty.txt,Were Buddhist monks included with the foreign travelers to Eastern-Han China?,Yes,M
/chinese_dynasties/Han_dynasty.txt,Which Emperor of the Han dynasty encouraged nominees for office to receive education at the Imperial University in 136 BCE?,Emperor Wu,H
/chinese_dynasties/Han_dynasty.txt,Was Han dynasty after Qin dynasty?,Yes.,M
/chinese_dynasties/Han_dynasty.txt,Which Emperor of the Han dynasty established the Imperial University in 124 BCE?,Emperor Wu,H
/chinese_dynasties/Han_dynasty.txt,The Han dynasty was succeeded by what?,The Three Kingdoms period,M
/chinese_dynasties/Han_dynasty.txt,Did science see a huge step back during the Han dynasty?,No.,M
/chinese_dynasties/Han_dynasty.txt,Which dynasty the Xin dynasty interrupted in 9 AD?,The Han dynasty,H
/chinese_dynasties/Han_dynasty.txt,Who was initially winning in the conflict betweeo Xiongnu and the Hans dynasty?,The Xiongnu.,H
/chinese_dynasties/Han_dynasty.txt,Who was preceded by the Qin dynasty?,The Han dynasty,H
/chinese_dynasties/Han_dynasty.txt,Was Wang Mang successful in outlawing slavery?,No,H
/chinese_dynasties/Han_dynasty.txt,Is the White Horse Temple China’s second known Buddhist temple?,No,M
/chinese_dynasties/Han_dynasty.txt,What is the modern name for the city of Chang'an?,Xi'an,M
/chinese_dynasties/Han_dynasty.txt,Was Xin dynasty after Chu-Han contention?,Yes.,H
/chinese_dynasties/Han_dynasty.txt,Which system switched the positions of furrows and ridges between growing seasons?,Daitianfa,H
/chinese_dynasties/Han_dynasty.txt,"After the imperial court enacted a series of reforms beginning in 145 BC, who was responsible for appointing the Kings’ staff?",The imperial court,H
/chinese_dynasties/Han_dynasty.txt,For how long was Han a de facto inferior and vassal partner of Xiongnu? ,67 years,H
/chinese_dynasties/Han_dynasty.txt,"Who was ranked higher in the social hierarchy, farmers, or tenants?",farmers,H
/chinese_dynasties/Han_dynasty.txt,What was considered dishonorable during marriages in the Han era?,"A lack of betrothal gifts, known as bridewealth and dowry",H
/chinese_dynasties/Han_dynasty.txt,Did multiple generations of extended family members did not occupy the same house in the Han era?,No,M
/chinese_dynasties/Han_dynasty.txt,Was the nationalization of iron industries in the Han dynasty permanent?,No,M
/chinese_dynasties/Han_dynasty.txt,Did the Xiongnu defeat the Hans?,No,M
/chinese_dynasties/Han_dynasty.txt,Has modern northern Sichuan ever had rebellion?,Yes,M
/chinese_dynasties/Han_dynasty.txt,Yang Xiong made advancements in what field during the Han dynasty?,Philosophy,H
/chinese_dynasties/Han_dynasty.txt,Did the Han dynasty force commoners to move to frontiers?,No,M
/chinese_dynasties/Han_dynasty.txt,When was the court conference that convinced the majority that the Xiongnu realm will fall into chaos? ,134 BC,H
/chinese_dynasties/Han_dynasty.txt,How long did Emperor Wu's liquor monopoly last?,3 years,M
/chinese_dynasties/Han_dynasty.txt,Did women work and make money?,Yes.,M
/chinese_dynasties/Han_dynasty.txt,Did the early Western Han court simultaneously accept multiple philosophical teachings in making state decisions and shaping government policy?,Yes,M
/chinese_dynasties/Han_dynasty.txt,Is the reason the Han dynasty is split into Western and Eastern Han is because of the Xin dynasty?,Yes.,H
/chinese_dynasties/Han_dynasty.txt,Did Emperor Wu annex Nanyue before annexing Dian?,Yes,M
/chinese_dynasties/Han_dynasty.txt,When did Qin Shi Huang die? ,211 BC,H
/chinese_dynasties/Han_dynasty.txt,How long did Wang Mang’s Xin dynasty last? ,14 years,M
/chinese_dynasties/Han_dynasty.txt,Was Chu-Han contention before the Han dynasty?,Yes.,M
/chinese_dynasties/Han_dynasty.txt,Was the Yellow River split into three new branches?,No,M
/chinese_dynasties/Han_dynasty.txt,How many peroids did Han dynasty have,two,H
/chinese_dynasties/Han_dynasty.txt,Did the Han dynasty see an increase in agricultural slaves?,Yes,M
/chinese_dynasties/Han_dynasty.txt,Who generally ruled Han society?,The emperor,M
/chinese_dynasties/Han_dynasty.txt,Were ducks among the Domesticated animals that were eaten during Han?,Yes,M
/chinese_dynasties/Han_dynasty.txt,How much extra poll tax does merchants need to pay compared to adult men?,120 coins,H
/chinese_dynasties/Han_dynasty.txt,Could the emperor be a child in the Han dynasty?,Yes,H
/chinese_dynasties/Han_dynasty.txt,Was wheat among the most common staple crops consumed during Han?,Yes,M
/chinese_dynasties/Han_dynasty.txt,What is the capital of the reunified empire under Han known as today?,Xi'an,M
/chinese_dynasties/Han_dynasty.txt,What were commonly eaten fruits and vegetables during Han?,"Chestnuts, pears, plums, peaches, melons, apricots, strawberries, red bayberries, jujubes, calabash, bamboo shoots, mustard plant, and taro",M
/chinese_dynasties/Han_dynasty.txt,What’s the time difference between Taichu calendar and Sifen Calendar?,0.00016 days,H
/chinese_dynasties/Han_dynasty.txt,"According to the Families throughout Han China, How many parts does a soul have?",2,H
/chinese_dynasties/Han_dynasty.txt,The Han dynasty was preceded by what?,The short-lived Qin dynasty (221–207 BC) and a warring interregnum known as the Chu–Han contention (206–202 BC),M
/chinese_dynasties/Han_dynasty.txt,What was the core idea of governing the country in the Han Dynasty after Emperor Wu?,Confucianism.,M
/chinese_dynasties/Han_dynasty.txt,Who expanded Han territory into the northern Korean Peninsula in 108 BC?,Emperor Wu,H
/chinese_dynasties/Han_dynasty.txt,In which year did Han dynasty have the upper hand in conflict with Xiongnu?,133 BC.,H
/chinese_dynasties/Han_dynasty.txt,Did the Qing dynasty fall in 1950 AD?,No,M
/chinese_dynasties/Han_dynasty.txt,Was Cai Lun 55 years old when he invented the standard papermaking process?,Yes,M
/chinese_dynasties/Han_dynasty.txt,What industries were nationalized as a result of the economic growth of the Han dynasty?,Salt and Iron industry.,H
/chinese_dynasties/Han_dynasty.txt,What are examples of wealthy clothes during the Han period?,"Silk robes, skirts, socks, and mittens, coats made of badger or fox fur, duck plumes, and slippers with inlaid leather, pearls, and silk lining",H
/chinese_dynasties/Han_dynasty.txt,Who was the first emperor of the Qin dynasty?,Qin Shi Huang.,M
/chinese_dynasties/Han_dynasty.txt,How long did Dong Zhongshu live? ,75 years,M
/chinese_dynasties/Han_dynasty.txt,Could slaves in the Han dynasty come and go from their master's home as they pleased?,No,H
/chinese_dynasties/Han_dynasty.txt,How many imperial dynasties were before Han?,One,H
/chinese_dynasties/Han_dynasty.txt,How long did Confucius live?,72 years,M
/chinese_dynasties/Han_dynasty.txt,When did the Han court establish the Wuwei frontier commandery?,111 BC,H
/chinese_dynasties/Han_dynasty.txt,How long did the Western Han dynasty last? ,211 years ,M
/chinese_dynasties/Han_dynasty.txt,How many massive floods happened during Wang’s regime? ,2,M
/chinese_dynasties/Han_dynasty.txt,What is an earthquake weathervane able to do?,It is able to detect the exact cardinal or ordinal direction of earthquakes from hundreds of kilometers away,M
/chinese_dynasties/Han_dynasty.txt,What duty did the kings lose in 145 BC?,Appointing their own staff,H
/chinese_dynasties/Han_dynasty.txt,Was the semiautonomous kingdoms larger than the centrally controlled commanderies by the beginning of the Western Han?,Yes,H
/chinese_dynasties/Han_dynasty.txt,Does the oldest surviving wooden halls in China date to the Han dynasty?,No,M
/chinese_dynasties/Han_dynasty.txt,What made Han forces' military campaigns enhance economic prosperity?,Silk Road,H
/chinese_dynasties/Han_dynasty.txt,Was Qin Shi Huang died in 221-207 BC?,Yes.,H
/chinese_dynasties/Han_dynasty.txt,Were animal bones among the typical ancient Chinese writing materials in the 1st millennium BC?,Yes,M
/chinese_dynasties/Han_dynasty.txt,Was Liuxiu an emperor of the Eastern Han?,Yes.,M
/chinese_dynasties/Han_dynasty.txt,What were the materials that the peasants wore in the Han dynasty?,"hemp, wool, and ferret skins",H
/indian_states/Punjab.txt,Which empire ruled the Punjabi region directly before the British?,Sikh ,M
/indian_states/Punjab.txt,Is Panjab known as place where growing crops is difficult?,No,M
/indian_states/Punjab.txt,Which war marked the end of the Sikh empire in Punjab?,the Second Anglo-Sikh War,M
/indian_states/Punjab.txt,How long did the Indus Valley Civilization flourish at ancient period?,"1,000 years",M
/indian_states/Punjab.txt,Did the Mughals came to power in 800 B.C.?,No,H
/indian_states/Punjab.txt,Which countries is Punjab part of?,Pakistan and India,M
/indian_states/Punjab.txt,What inflences the agriculture in Punjab greatly?,The climate,M
/indian_states/Punjab.txt,Was Sihikism accepted by the other religions?,yes,M
/indian_states/Punjab.txt,Is it true that a majority of Indian Punjabis are Sunni Muslims?,No,H
/indian_states/Punjab.txt,How many rivers and mountain make up the boundary of the Punjab Province?,3,H
/indian_states/Punjab.txt,What religion was practiced before Buddhism and Jainism in the Punjabi region?,Hinduism,H
/indian_states/Punjab.txt,Are the civil unrest and the shift towards religious homogeneity two major consequence of partition?,Yes,H
/indian_states/Punjab.txt,When is the monsoon season in Punjab?,from Jupy to September,H
/indian_states/Punjab.txt,Which continent is Punjab located?,Asia,H
/indian_states/Punjab.txt,When did Alexander the Great invade Punjab?,326 BCE,M
/indian_states/Punjab.txt,Who established the Gujarat Sultanate in 1407?,Sultan Muzaffar Shah I,M
/indian_states/Punjab.txt,Did the Hundu Shahi rule much of Punjab and eastern Afghanistan in the ninth century?,Yes,M
/indian_states/Punjab.txt,Around when did the first civilizations arise in the Punjabi Region?,3000 B.C.,M
/indian_states/Punjab.txt,How did Multan become the center of Islam?,Because the Umayyad conquered the region and Islam emerged powerful,H
/indian_states/Punjab.txt,What is the name of the war that began after the British annexation of Punjab in 1849?,the First and Second Anglo-Sikh Wars,M
/indian_states/Punjab.txt,To which river do the 5 rivers of Panjab act as tributaries to?,Indus River,M
/indian_states/Punjab.txt,Is there a city in the Punjab region with a bigger population than Lahore?,No,M
/indian_states/Punjab.txt,When was Islam first practiced in the Punjabi region?,800 A.D.,M
/indian_states/Punjab.txt,Is Hindus a significant minority faith of Pakistani Punjabis?,Yes,M
/indian_states/Punjab.txt,Is climate important for Punjab's agriculture?,Yes,M
/indian_states/Punjab.txt,Did Khizr Khan travel to Samarkand?,Yes,H
/indian_states/Punjab.txt,What is the largest city in the Punjab? ,Lahore,M
/indian_states/Punjab.txt,Is it true that most of Pakistani Punjabis are Shia Muslims?,No,M
/indian_states/Punjab.txt,Why was British India formed?,Because the British annexed the Punjab,H
/indian_states/Punjab.txt,The boundaries of what region are ill-defined and focus on historical accounts,Punjab,M
